{
  "schemaVersion": "2.0.0",
  "catalogVersion": "sc01-draft-20260121",
  "vehicleId": "sc01",
  "configurationId": "cfg-ad25824327ecb6e53be912c0",
  "renderKey": "sc01__sc01-draft-20260121__render-ad25824327ecb6e53be912c0",
  "selections": {
    "exterior-body-cover": "body-cover-red",
    "wheel-material": "wheel-aluminum-alloy",
    "wheel-style": "wheel-style-multispoke",
    "wheel-color": "wheel-color-bright-silver",
    "lower-skirt": "lower-skirt-aluminum",
    "front-caliper-color": "front-caliper-black",
    "rear-caliper-color": "rear-caliper-black",
    "engine-bay-cover": "engine-cover-ppg",
    "steering-wheel-skin": "steering-skin-ultrasuede-black",
    "steering-wheel-addon": "steering-addon-eva",
    "steering-center-mark": "steering-center-standard",
    "seat-backrest": "seat-back-ultrasuede-black",
    "seat-bolster": "seat-bolster-microfiber-black",
    "seat-shell-back": "seat-shell-black",
    "seat-headrest-mark": "seat-headrest-standard",
    "door-upper": "door-upper-microfiber-black",
    "door-middle": "door-middle-ultrasuede-black",
    "door-armrest": "door-armrest-microfiber-black",
    "door-armrest-skin": "door-armrest-skin-microfiber-black",
    "ip-wings": "ip-wings-microfiber-black",
    "ip-middle": "ip-middle-microfiber-black",
    "ip-instrument-cover": "ip-instrument-cover-microfiber-black",
    "ip-upper-trim": "ip-upper-trim-microfiber-black",
    "ip-lower-trim": "ip-lower-trim-microfiber-black",
    "ip-center-mark": "ip-center-mark-black-paint",
    "storage-soft-bag": "storage-soft-bag-microfiber-black",
    "console-armrest-cover": "console-armrest-cover-microfiber-black",
    "console-armrest-side": "console-armrest-side-microfiber-black",
    "handbrake": "handbrake-microfiber-black",
    "roof-surface": "roof-woven-standard",
    "a-pillar-surface": "a-pillar-woven",
    "interior-painted-parts": "interior-painted-spray",
    "door-sill": "door-sill-leather",
    "embroidered-logo": "embroidered-logo-standard",
    "center-panel-trim": "center-panel-trim-custom",
    "shift-knob": "shift-knob-stainless",
    "brake-handle": "brake-handle-flamed-blue",
    "pedal": "pedal-racing"
  },
  "customizations": {}
}
